{
  "schema_version": "1.0",
  "event_id": "17f496c8-4ff8-4fae-bf57-74b76931afef",
  "event_type": "customer.approved",
  "occurred_at": "2026-10-22T03:00:00Z",
  "customer_version": 1,
  "customer_id": "1000000123",
  "company_ref": {"id": "example-caf-company-cuid", "code": "INFOBB2548"},
  "franchise_ref": {"id": "example-caf-franchise-cuid", "code": "INFOBB2548-F01"},
  "caf": {
    "application_id": "example-application-cuid",
    "number": "INFOBB2548-CAF-EXAMPLE",
    "revision": 1,
    "status": "APPROVED",
    "approved_at": "2026-10-22T03:00:00Z"
  },
  "profile": {"name": "Example Customer", "mobile": null, "email": null}
}
